text,label
meskipun suka kalap  wkwkwkwk ampuni hamba ya allah  tapi hamdalah selalu bayar cc lunas tiap bulan  kalau kalap yaaa berarti memang salah diri sendiri  insyafnya buat bulan depan   cc kata saya berguna sangat for someone who cant save money for me  its not good i know but   but  ,1
kadang ingin mencari peluang lain  tapi disisi lain belum bisa meninggalkan keadaan saat ini karena memang udah setengah jalan  feeling like i am not able to compete in looking for another chance   because i still need more experiences here ,0
 dih gitu saja   mana foto nya          sudahlah  thank you temannku  you know me so well  kok  ,1
when you have friends kerjaannya ngeduluin you ngomong mulu  cc  samsolese,0
kamu road to apa   ,1
menang dong pasti sandi   hidup infrastruktur langit   what infrastruktur langit,1
terkes ia wonderfull,1
orang indonesia stupid     ,0
angnya sangat perfeksionis  inginnya segala hal sejalan dan harus perfect   pernah waktu itu di salah satu show dia salah nyanyi in lirik lagu rokkugo terus waktu turun stage mukanya langsung merah terus menangis di ruang make up sampe di tenangin sama taemin ,1
tidak pernah mendalami al quran ya bang    pantesan mulutnya seperti orang kafir bejat hina farhatabbaslaw,0
selalu denger  biar publik yang menilai  publik sudah pintar   well clearly we do not,0
girls protecting girls   wuih keren yaa  mereka saling support   mens protecting girls   modus bangsat ,0
yang ada jin nya itu  nyimpen saya keknya dibookmark tapi bukan thread sih keknya screenshot an gituu,1
aku tim debat sekolah  not so good juga sih  sering masih ada salah  tapi selama latihan awal awal klub  fokus senior aku maksa kita buat terbiasa ngomong sendiri ngomong depan publik ,1
persib weak selalu,0
i think the only person who knows me too well  too well  sampai busuk busuknya pun hanya terlalu banyak petualangan kalau sama dia mah ,1
we age  not by years but by stories   pt  pengangguran banyak duit,1
artinya kalau kamu sejak awal sudah menyuruh bikin sesuatu yang random  mau kita jungkir balik tetap bakal unusable  it is not the interns fault  bilang saja malas supervise anak magang  lebih baikan disuruh fotokopi is quite the extreme  but you get the general sentiment ,0
 get_repost   alakazam tour merah putih gudang garam      thanks to relic management yang telah editing kumpulan video tour merah putih gudang garam      alakazam ,1
wow  so sad to hear that  hopefully all parties can find the best solution   icelandic budget airline wow air collapses  leaving passengers stranded   huffpost ,1
 ah iya  aku fayza  but well known as phey  suka bts sama anime sport   mistery  haikyuu bsd favorite saya    sekarang lagi nonton code guys  kemaren minta recomendation sama komunitas anime di quora  banyak yang sarankan itu hehe  oiya aku domisili bandung,1
nflying rooftop is playing in an indomaret near my place,1
dengan menekan perusahaan tambang dengan target proyek yang impossible  lalu di lelang murah pada antek cina  ntb contoh kasus  pdip mau menang  dasar bajingan ,0
search shoes  not met  susi anggraeni   dede kurniasih ,1
apalagi   kalau godain orang lain  well  aku posesif  rio punyaku    sama   kalau susah dikasih tau  disuruh demi kebaikannya  malah  ,0
jumat include tebet promo lt dari jam    an sampai jam   pagi     diutamakan yang pernah bo yaa   rate lt silahkan direct message wa ,0
been there before  tidak apa apa kak  memang itu benteng pertahanan kita daripada kitati sama orang yang salah  ,1
bukannya susah  soalnya pernah kaya gitu but he s not care haha,0
some of us kali lebih tepatnya  soalnya temen temen saya baik baik saja sama saya tetap main ngajak makan bersama bersama,1
line excuse me i should be the one who said that to you my dear lil brother eh by the way kemarin kan abang datang ke set syuting  terus iseng foto  ganteng tidak ,1
life is like a phone call with a loved one  when it is cut short  we realize how much of it we have wasted   klbseagul  hidup itu ibarat telepon dari sang kekasih  ketika terputus tiba tiba  kita sadar berapa banyak waktu yang telah disia siakan ,0
uh    bakal susah  saya cuma kepikiran c section kalau pun laki laki nantinya bisa melahirkan  there is not enough space between the scrotum and the anus  kalau di belakang anus udah ketemu pantat  man i do not know  anatomy makes my head hurts    ,0
i am not into politics by the way  cuma kasian aja ini dosen saya orangnya baik tapi diginiin sama makhluk tidak bertanggung jawab,0
 saya cabut  ya  jaga diri kamu  saya yakin kamu bisa  duluan  bang arkan  see you when i see you  semoga tuhan iseng lagi nanti bikin kita ketemu    setelahnya  audrey melangkah pelan menuju rumah  meninggalkan segala macam nostalgia bersama arkan di sebuah taman    e n d,1
you re not  kak salka    butuh teman cerita ,1
see  a crowd pleaser   mana itu semua yang komplain soal  this is a family movie   what do you expect  this film serve the purpose to entertain young children,0
timing komedinya bagus sih tapi kadang ada bagian yang menurut saya  ini sepertinya not meant to be funny  tapi ada yang ketawa tuh agak mengganggu distracting hahaha memang pengalaman menonton itu kadang unik,0
apa bedanya donut sama doughtnut ,1
ngeupdate  masih saja sindir orang di status  well  kadang memang otak  hati mulut  tangan tidak sinkron  atau memang tidak ada otak ,0
going all out with your partner cuma di sesi    seseneng itu   makasih tuhan yesus    ,1
thats why selalu males ke cs bank  maunya cuma ganti kartu  buka m banking malah ditawarin unit link ini itu,0
saya benci sangat typo aaakkk my fingers why you  like this typo pas minta approval bos dan aku malu walaupun bos saya tidak peduli neep apaan anjir d sama p kan jauh,0
mashaallah laki saya ganteng amat  nangis saya woy  visualnya tidak pernah bercanda  gans abis  lee donghae sayangku  cintaku padamu  love you to the moon and never back  ,1
mau bilang itu bunga tapi yang lain sudah pada protes  i will give you a bunch of love as well  good morning ,1
ah  memang mesti luangkan waktu buat kemari lagi sambil cuti  tidak buat kerjaan haha  well noted and masuk to do list ,1
ngapain sih spill spill spill spill  memang tidak bisa diomongin berdua baik baik aja gitu  kalau memang sudah sebel sama orangnya ya tinggal putus komunikasi susah sangat  not cool dude ,0
when the night has come   tvri stasiun pusat jakarta ,1
katanya  itu urusan pribadi      well ini bukan cuma masalah duit    tapi  pengisian jabatan di kementrian agama  nya itu jadi pertanyaan besar      jadi ada acara isi  jabatan gitu ya  ,0
tidak mengerti sih saya sama cowo yang pake celana gemes ke mall  not judging  just stating that i do not understand,0
kau tahu  sudah hampir satu jam kuputar ulang lagu ini  kau ingat masa itu    gitu  gitu  cause i will fall for you no matter what they say  i still love you i still love you you will never be alone now look me in the eyes  i still love you i still love you   mikha angelo,1
terus nyala tapi buat speedtest saja tidak bisa server not found jangan suruh saya beli laptop di rumah handphone cuma   baca inbound dulu sebelum balas ya         ,0
strong power thank you infires man lacibolala kkaepjang you got no jams  atelelele you can do it  friends  you can do it tukala tukala tuka tukala lezzgedit respekt ,1
i usually not going to share things about pollitics  and this one is none about it  i think  cuma bacaan yang membuka pemahaman saya saja tentang rakyat indonesia yang  mungkin  memang belum siap menjadi warga negara yang maju ,0
samaa  that and slept on top of my chest  not on the sides or feet  above     saatnya mengajari dia tidur di luar lagi ,0
five feet apart itu kocak dan agak mengesalkan  sama sempat buat mata berkaca kaca juga di beberapa scene  soundtrack nya enak sangat sangat by the way  overall  film nya bagus dan nonton nya hepi karena dapat diskon wkwk   because i am not giving up  i am not giving up  giving up  no not yet    ,1
well cobaanya bisa baik buruk ko       ,1
lagi sakit ditinggal sakit juga  dan ketika saya butuh mengobrol orang orang hilang  well done me and march,0
emak kamu jualan ya  bajingan  anak stripper kau rupanya,0
elitism  isi tabungan bisa juga beli barang yang dijual di mall bling bling tapi ya rasanya tidak worth saja  lebih nikmat makan di nasgor pinggir jalan depan fx dari pada di dalem fx  because i enjoy food  not enjoying paying tax and services ,0
its funny when fans grup a yang bikin tweet party karna anggota grup b pensiun lalu di send hate abis abisan  terus sekarang fans grup b juga mendukung  ih lucu  ,0
lagi nahan buat tidak nyinyir  at least not in public,0
i know this very well  jangan lupa  kita mungkin generasi terakhir yang tiap hari minggu  atau sore hari berdebar penasaran liat kartun favorit di tv  sekaligus sekarang bisa youtubean kalau kangen kartun tersebut,0
   irsyad itu nyenenginnya dia penurut kalau dikasih tau  terima terima aja  i do not know he will do it or not  he respect me as his older brother ,1
hatred does not cease by hatred  but only by love  this is the eternal rule  buddha  kebencian tidak akan berhenti dengan kebencian lagi  hanya dengan cinta  ini adalah aturan yang abadi ,1
reposted from wilson_mci     persiapan vietnam semakin matang  ittin sudah ada dan bisa dilihat di website  plakat sudah mulai terlihat hasilnya  tshirt model jersey untuk vietnam juga ,1
paling tidak bisa lihat anak sebaik dia yang selalu terus terus an dibuly   halooo dia juga manusia biasa   sekali saja lihat dari kerja keras dia yang sudah menghabis kan masa anak anak nya buat negara  tuhan kuatkan dia  kembalikan rasa percaya dirinya agar dia mampu tuk kembali menjadi juara ,1
kan  kita ni syukur ada sources  yang tidak ada itu  sibuk suruh cari part time  some bragged how they did well in university  nahh  at the end nak suruh orang tutup mulut diam terima redha life as a student macam tu  i thought kita kena tolong improvise everyone life  nak      kot  hahaha,0
kamu bilang sayang sama saya  tapi kamu milih pergi sama dia  so  which one should i believe ,0
debat ketiga pemilihan presiden  wakil presiden          kata aja well done   indonesia      kartu sakti anti ribet anti mafia kartu  e ktp ,1
ever has it been that love knows not its own depth until the hour of separation  kahlil gibran  cinta tidak akan pernah diketahui kedalamannya sampai  merasakan  jam jam perpisahan ,1
well  dengan menggunakan id yang mudah untuk memancing para bot mampir stalking ke akun saya di tambah pose badan saya yang shirtless menunjukkan hasil gym belakangan ini  saya rasa akan mudah mendapatkan apa yang saya mau,1
missed calls oleh ryan oakes,0
cowok positive thinking pasti bilang  apaan si  tidak jelas  cowok negative thinking pasti bilang  heh   kamu disuruh siapa kirim kirim begini  pasti kamu salah kirim kan  ngaku saja sudah  lagi selingkuh kan kamu anjing ,0
keberagaman bukan alasan kita sebagai masyarakat indonesia untuk bertengkar ,1
so what  setting di bagian yang reff dijamin kaget   not today sama fire juga,1
hahaha     banci kaleng langsung jatuh kalau ditanya    pakai akun palsu    kalau tidak banci  ya saracen   waspadalah   waspadalah,0
tiap ada masalah dishare ke status whatsapp  why ,0
ehhh welcome back a   sering sering tengokin twitternya  sudah berdebu itu haha,1
udah hampir jadi  malah not responding  tit ,0
you are not alone  saya juga salah satu orang yang pada akhirnya lebih nyaman sendiri karena terlalu lelah dikecewakan oleh society  mungkin taraf kecewanya saya for some people udah sampe taraf kamu mau ngapain saja bodo amat anjing saya sudah tidak peduli lagi mau die juga bodo amat ,0
not lucky brother  penalti saja bangga wkwk,0
div mau ikut ke probably not,0
kapan bisa   some sama kalian hehe,0
 ap  ban cars outside uk schools to tackle air pollution  teachers say,0
buat first time visitor buat saya  harusnya disediain disclaimer  not suitable for toddlers and the elderlies  secara panas sangat dan tentunya tempat duduk terbatas  kasian kemarin liat mereka  pakai sunscreen juga perlu,1
pengen deh ngerestart kuliah tapi maunya dari semester   because semester   masih maba and maba life was suck,0
kalau masalah got mampet di jakarta tidak sampe jam jaman sudah langsung dikerjakan  karena disetiap kelurahan sudah ada team ppsu  kalau masalah ayunan perlu pekerja khusus karena menyangkut keselamatan orang banyak  sekian pendapat saya  kalau ada yang salah mohon pencerahan ,1
been there done that  mantan saya di  unboxing  sama jok sepeda bmx nya,0
  army bombs has been secured  yang mau order bisa ya    k udah termasuk tax  down payment    k langsung dibeliin  buru nanti sold out di web bh nya ,1
during the opening of a seminar i attended yesterday    image of ken yeang  an architect  appeared   my office mate   whispers   kalau habis makan jadi apa  ken yeang    hehe  hehehe  heheheheheilovemyofficematestheyrethereasonistaysane,1
mbak       itu dia memang caper dari dulu  sebuah testimoni yang aku dapet dari orang yang kenal sama dia   jadi whatever happens i just want you to be well and not take this whole thing personally  semangat sekolahnya ya,0
it is not a mountain we conquer but ourselves  edirect messageund hillary  pic by  ikkafatma     terimakasih sudah join bersama    tag  dan gunakan    ,1
not habits   tekanan,0
ngomong kamu dasar ya jelas christian kafir,0
buka earphone eh dengar suara hujaan  sleep well,1
rt user  hari hari makan babi berbentuk uang haram  muka pun macam babi  perangai lebih babi dari babi  politician ronggeng babi ,0
not at all  hanya seorang pencinta kucing,1
i am not oke kalau tidak ketemu mereka pas ulang tahun    ko   ,0
banyaknya generasi milenial yang menyukai jokowi because pemerintahan jokowi mendukung industri kreatif  milenial mendukung jokowi demi indonesia lebih baik ,1
argh gimana cara save gif nya ,0
gitu dong   berani  saya sih berani berani saja jadi penanggung jawab  tapi saya mau sebar dulu ke anak cowonya  siapa yang berani  ketua angkatan no reponse dari awal ditanya  yang tertua juga tidak bisa kasih jawaban  so  i was really glad when you gave  yaudah  answer ,0
i tried to cheer my self up  but it is not working  tapi aku tidak mau berhenti supaya aku bisa bangkit dari keterpurukan     dan   lagi selalu berdoa   ,1
ada selebgram  actually not really sure about she is a celeb or not  but isi feed penuh iklan baju   dia pamer di ig story video  lagi buru buru  nyetir lewat jalur busway  sementara kelihatan di jalur biasa lagi pada antri macet   sadar tidak ya kalau otaknya ketinggalan ,0
any suggestion japanese release mau giveaway apa  go ahead  we are listening ,1
cayang bangeeet  kamu kenapa get well soon ya   kerja jangan capek capek harus inget kesehatan  love,1
dear tim eco  pls fix it the soonest   dari semalem offline  thank you ,1
follow back lah min,1
kemaren paniju paniju ini lagi kentang keju       where are you now nder,1
aku tetap vote jk seperti kemarin  aku tuh yakin ini juki yang galau  ada vibe jelly gitu  lagian ini anak berdua aneh  lagi pendekatan tapi nge spill sama rival  kaya yang cuma buat ngomporin satu sama lain  cuma nebak ya hehe  well ku serahkan padamu saja lah wahai author  ,0
bye bye my hairs   jalan kebon jeruk xiii   jakarta kota ,0
saya sepertinya ngomong diakhir akhir dah  so it is not what i think you are saying then   kalau tidak tinggal jawab tidak gituloh  saya ngomong satu hal tiba tiba kamu bales bejibun dan tiba tiba ada aja yang out of context,0
well  kalau tidak mau ditembak  jangan pernah kasih kesempatan dong  cowok paham jika memang cewek itu tidak bisa untuk ditembak  dan kalau dia ganggu  diemin ajalah selesai urusan,1
buka ig terus di suggested for you ada nama mantan  hmm kenapa harus muncul sih,1
the greater the love  the greater the tragedy when it is over   nicholas sparks  semakin besar rasa cinta  semakin besar pula tragedinya ketika cinta itu berakhir ,1
dom jakarta timur tonton captain marvel hari sabtu habis uambn selesai mau refresh otak hehe semoga ujian nya lancar ya kak wish me luck,1
boeing ceo says safety is highest priority but company charges extra for some safety features,0
era spring day or not today  tidak tahu ahhh pokoknya pas era wings tour in jakarta     ,1
sepertinya memang saya tidak pernah mencintai seseorang  selain diri saya sendiri  dan kemungkinan hal ini yang membuat saya tidak pernah benar   benar berjuang untuk pacar   pacar saya dulu  when they asked to break up after we fought  i will say yes easily ,0
down payment         meet up bersama novi yuk  info rr by direct message   ,1
art is not illegal   pasar tasik kebon jahe  cideng ,1
semangat siang   done  sosialisasi pengelolaan sampah kawasan usaha    hari ini dunia usaha wilayah jakarta utara   jakarta terus bergerak   semoga pembuangan  sampah ke tpa bantar gebang terus berkurang   selalu ada cerita   salam clean and green   wilda yanti,1
masih tetap suka standup comedy  well   tetap nonton dan tetap suka  cuma bedanya sekarang tidak nonton live  tapi tidak berubah kok  tetap support standup  i can forget some people whose hurt  but from others  i cannot forget happiness ,1
yaela isat mah tidak profit  lebih baik tidak usah di buyback wkwk  not worth,0
dear apk lagi trouble kah  kode booking not found kenapa    padahal pembayaran sebelum waktu tenggat dan sudah ada pembayaran,0
wkwkwk kue bandung saya baru tau lol  saya sih dulu tau nya ya martabak saja   mau martabak telor or manis ya teteup  martabak   makanya pas ada yang bilang terang bulan saya kira kue chinese gitu,1
semalem saya nangis nonton vkive hyunjin pas pertengahan dia ngomong soft      sangat   terus matanya berkaca kaca  pas dia ngomong  an uroyo    sebenernya matanya seperti mau nangis,1
mungkin sama komen nya dia waktu dapat gelar santri terus tidak lama jadi ulama    it is not a good example definitely ,0
in the future  robot  not document  will diagnosis your disease  dari public lecture pak ronny adhikarya di fkm ui   ayo indonesia harus siap  semoga lewat anak bangsa bisa berkarya  cc  ,1
iu through the night  sama ostnya i am not robot  sumpah itu lagunya kena sangat parah ,1
weak kamu,0
cumlaude s  seni clickbait dan misleading caption,0
it is not a lack of love  but a lack of friendship that makes unhappy marriages   friedrich nietzsche  bukan karena kurang cinta  tapi kurang persahabatan yang membuat pernikahan tidak bahagia ,1
acara yang men dungu kan dan membiadab kan bangsa  mengaji budaya dari muhammad arab buta huruf mengaku nabi  ganti budaya baca,0
maret  bulan nya boros  bulan nya mager  bulan nya baperan  bulan nya tidak produktif   for me,0
well said   semua tahu siapa yang salah kok  tetap semangat,1
youtube   up subscribe like favorite views yuk order silahkan mention atau contact bbm     b   f  wa               ,1
get well really soon koko banyak banyak istirahat ya koooo ,1
chelsea is blue real madrid is white hazard is bored in blue so he wants to move to the white  puisi apa sih nih   ,0
sekarang ada penembakan di utrech  whats going on people ,1
anak haram  bastard  terkadang memiliki derajat yang lebih tinggi karena usahanya  well iya semua orang kalau berusaha  hasilnya akan balance dengan usahanya,1
when atasan terbaik kamu pindah ke area lain  tapi atasan terngeselin kamu dulu malah balik lagi kesini   kenapa tidak pindah pindah itu orang,0
yang tidak pernah marah itu cuma malaikat   manusia mustahil tidak pernah marah   jangan jadi pengecut dan penakut dong    malu sama anak milinial   haha,0
everything went well when i took the more complicated portion  tidak ada drama rebutan qs karena mereka bisa kerjain bagian yang lebih gampang sesuai target bahkan lebih cepat   nah sekarang  karna saya khawatir waktunya ga cukup  trus qs saya dikekepin orang lain muluk  drama deh ,0
get well soon  cuaca tidak tentu  harus pinter pinter jaga kesehatan vien,1
yang mau ngatain atta yok yok louder guys    you not alone  ,0
sandi akan kick off kampanye akbar di sragen  izin belum dikantongi,0
not today hehe lagi kerja nih,1
fitnah fitnah tapi di like juga dasar onta,0
sebelum nya cek resi   hari lalu     hasil nya on process     dan hari ini saya cek ulang keterangannya malah not found   ini gimana ya soalnya barang belom sampai     customer nya sudah mengeluh saja ke saya    ,0
selamat pagi indonesia    ,1
by the way saya naik tj pas makan hehe kalau di singapura namanya trans singapura apa gimana mas  i know it is wrong but urge to me  i am not eating with mess and spreading smell things i am just sharing my opinion and stories,0
apa saya saja ya yang not even care     kamu mau bontel kek asal care itu cowo yang joss wkwkwk,0
orang orang tuh ya kenapasi padahal im trying my best to not being rude atau keliatan sombong atau apalah tapi kenapasi kalian tuh ya ngelunjak bangsat           ,0
jangan salah target bukan ahok    agenda utama lengserkan jokowi,0
pt saya tadi pagi kasih beban terberat saya sejauh ini   kamu pasti bisa ed  klien saya umur    aja bisa  cewek lagi  tiba tiba dia gugup dan langsung buru buru tambahin  eh bukan gitu maksud saya ya  maksud saya cewe  langsung saya potong  relax man  you are not on twitter here ,0
kalau ditarik garis besarnya    suatu saat nanti di alam kematian  sepertinya tidak mungkin manusia tidak diperbolehkan untuk membela diri atas hal hal yang harus dicari tahu dan dipelajari sendiri  tanpa bimbingan siapapun   i mean  we are not like the prophets  right ,0
screening pertamanya di tiff      bulan september kemaren  bayangkan   bulan menunggu nya  jamuran tidak tuh bolly lovers menunggu nya  we cannot wait to watch  please,1
well  si staguf memang yahudi tulen yang benci sama arab,0
ini kemarin bahkan ada yang nyalahin vip yang terutama sering kritik seungri tidak sebagus talenta hyungnya  makanya dia tidak dengerin hyungnya  terus berbisnis untuk pembuktian diri   mannnnn   that is not an excuse   ____ ,0
why not menurut saya mah  orang di kemenag juga kan ada badan badan agama yang lainnya kok  semua agama diurus kemenag  cuma  mungkin untuk sebagian orang kurang etis karenaa disini mayoritas muslim rt   gimana kalau menag nya sekali sekali orang kristen    peace    no twitwar   ,0
kurang lebih begitu saja si  tapi intinya saya capek ketawa mulu dan belajar banyak hal dari semua materi komika hari ini  semoga berikutnya  standupindo bisa lebih well prepared lagi  bukannya tidak bagus  tapi masih ada yang kurang dikit dikit  berkah buat semua  aamiiin,1
well noted  mau liat jisung  doyum  taewoo actually mau lihat ke   nya uwu ,1
lagu when the partys over dari billie ini bercerita tentang muaknya billie dengan kisah percintaan loh  blisteners  dan ternyata cairan hitam yang jadi air mata di video klip ini masuk ke mata billie eilish ,1
not that yowes karepmu mas wkwkwk,0
dan kalau kita berteman sama tukang minyak wangi pasti akan terikut wangi    sebaiknya jangan berteman sama maling untuk bicara kejujuran,1
untuk tata laksana cover obat bisa dilihat pada undang undang  trastuzumab masih dicover bpjs tapi penggunaan trastuzumab untuk stadium   tidak lagi efektif menurut dewan uji klinis  jadi apakah untuk stadium   masih di cover bd dibaca lagi pada uu nya ,1
ketika kamu selesai makan  melihat temen kamu masih makan   menyisakan kulit ayam dipinggiran piring  dengan rasa peka  doi pun suruh kamu menghabiskan sembari curhat kalau dia tidak suka kulit ayam  gass terooss beruntungnya hamba  ,1
subhanallahh   signal telkomsel buat gemesssss    tiap malam pasti ngadat  yoo weslah tak tinggal turu wae  good night all,0
nah itu juga  pada suka asal komen  lanjut sister    i got your back  keluarkan   ,1
well   saya ganti seprai sebulan sekali  terus ganti baju tidur tiap  x pakai sih  entah kenapa sama seperti isi artikelnya    but i always keep my bed clean ,1
not good  not good   maag saya selalu kambuh sejak kerja di sini   stres,0
jam   subuh buat pikir but okay   sepertinya sih bisa  soalnya itu seperti mem pengaruhi indera perasa kita tapi bukan alat gerak jadi kita bisa gerak bebas  well orang disantet masih bisa bangun tidak sih  i do not know man,1
which brings suffering is not a problem in itself  but our reaction when facing it    yang membawa penderitaan bukanlah masalah itu sendiri  melainkan reaksi kita saat menghadapinya  ,1
saya kembali ke sudut jalan itu  dimana itu pertama kali kita bertemu  i am not gonna move,1
i am not perfect  tapi jago bikin kamu merem melect ,0
im not your type  makannya aku cari orang lain ujar dia  selama ini aku bales chat cepet  kamu anggap apa    remahan stiker,0
well   baru saja tengok trending  ternyata instagram down bersamaan dengan facebook   whatsapp,0
based by pengalaman pribadi  dari lumayan banyak pasien ku  iya yang cerita sm velia  selingkuh itu sudah habit  ada salah satu cewe yang ceritain mantannya selingkuh sama cewe yang notabene juga masih punya pacar  well mereka masih jadian until now ,0
anjing kurap ini keliatannya sibuk dengan handphone murahannya  jadi  mungkin dia tak memperhatikan kalau saya lewat   saya pikir aman untuk malam ini  but  its not ,0
yaiyalah  klo ditembak mah bisa mati  v but rezeki pantang ditolak,1
jangan gaduh lahh   kami yang kau panggil cebong sudah tidak butuh manusia munafikun,0
i am not ok   tidak dapat ga ikon dari ko,0
this is real world  not fairytale bedtime  karena jatuh cinta itu udah sepaket sama sakit hati  kalau kamu jatuh cinta tanpa ngerasain sakit hati  itu bullshit ,0
hiii semoga lancar yaa aku yakin kamu pasti bisa  apalagi kalau sudah berusaha pasti tidak bakal sia sia semangat you can do it baby,1
jangan lupa terus bersyukur pada tuhan   ,1
novel harap polri adil proses hukum said aqil ,1
duh chelsea favorite  tapi lagi down  anjir apalagi kalau hazard out dari chelsea,0
tenang yan   kalau sudah waktunya  pasti ada yang ajak kamu kok  sesederhana apapun keadaan nya itu akan menjadi yang terbaik   all is well yan   all is well   jangan lagi menekan dan memaksa siapapun  kasian mereka   itu tidak baik ,1
